{
  "contract_variant": "caesar-awesome",
  "run_id": "ui_ux_gauntlet_20260731",
  "goal": "Continuously improve the real mobile UI/UX from user feedback, beginning with war-zone exploration desire while preserving the accepted title and factory-world direction.",
  "player_outcome": {
    "target_player": "first-time mobile landscape light-SLG player familiar with anime city-war imagery",
    "platform": "Godot 4.6.3 Web, 844x390 and 568x320 landscape",
    "play_window_seconds": [
      20,
      60
    ],
    "control": "selects a campaign landmark, changes chapter, opens contextual detail, and chooses the primary action",
    "threat": "locked frontier, hostile occupied city, and uncertain stage capability",
    "choice": "explore the next landmark, prepare the legion, or attack the selected stage",
    "feedback": "world-first map, route state, landmark silhouette, selected detail, and one contextual primary action",
    "outcome": "understands territorial progression and wants to reveal the next occupied location without searching through UI panels"
  },
  "constraints": {
    "engine": "Godot 4.6.3 GDScript Compatibility renderer",
    "target_runtime": "single-threaded Web and mobile landscape",
    "asset_policy": "original generated or repository-owned raster assets only; no unlicensed copied franchise art",
    "scope": [
      "title, factory, war-zone and cross-screen UI/UX challenged by the user's feedback",
      "focused war-zone exploration slice",
      "one conditional whole-path integration checkpoint"
    ],
    "out_of_scope": [
      "combat balance",
      "new campaign rules",
      "commercial release certification"
    ],
    "accessibility": [
      "state is encoded by silhouette, icon and position in addition to colour",
      "44px-or-larger touch targets",
      "critical action remains visible at both target viewports"
    ]
  },
  "quality_dimensions": [
    {
      "dimension_id": "assets_modeling",
      "label": "Assets and modeling",
      "applicability": "in_scope",
      "scope": [
        "title hero art, map landmark silhouettes, and formation character portraits"
      ],
      "gate_ids": [
        "gate_ui_visual",
        "gate_factory_visual",
        "gate_legion_visual",
        "gate_codex_visual",
        "gate_faction_choice_visual",
        "gate_blueprint_forge_visual",
        "gate_action_compass_visual",
        "gate_achievement_cabinet_visual",
        "gate_growth_duel_visual",
        "gate_doctrine_deck_visual",
        "gate_breakthrough_reveal_visual",
        "gate_pass_runway_visual",
        "gate_chapter_victory_visual",
        "gate_boss_briefing_visual"
      ],
      "rationale": "The user explicitly challenged character identity and generic AI-looking landmarks."
    },
    {
      "dimension_id": "materials_shaders_lighting",
      "label": "Materials, shaders, and lighting",
      "applicability": "in_scope",
      "scope": [
        "map depth, occupied-city atmosphere and readable value hierarchy"
      ],
      "gate_ids": [
        "gate_ui_visual",
        "gate_high_dpi_visual"
      ],
      "rationale": "Exploration desire depends on depth and atmosphere rather than flat panels."
    },
    {
      "dimension_id": "motion_vfx",
      "label": "Motion and VFX",
      "applicability": "not_applicable",
      "scope": [],
      "gate_ids": [],
      "rationale": "This first bounded wave changes static map composition and HUD hierarchy, not temporal VFX."
    },
    {
      "dimension_id": "ui_ux",
      "label": "UI and UX",
      "applicability": "in_scope",
      "scope": [
        "title simplicity, factory contextual HUD, war-zone hierarchy, formation identity and feedback flow"
      ],
      "gate_ids": [
        "gate_ui_visual",
        "gate_ui_runtime",
        "gate_player_learning",
        "gate_legion_visual",
        "gate_legion_runtime",
        "gate_codex_visual",
        "gate_codex_runtime",
        "gate_faction_choice_visual",
        "gate_faction_choice_runtime",
        "gate_blueprint_forge_visual",
        "gate_blueprint_forge_runtime",
        "gate_action_compass_visual",
        "gate_action_compass_runtime",
        "gate_achievement_cabinet_visual",
        "gate_achievement_cabinet_runtime",
        "gate_growth_duel_visual",
        "gate_growth_duel_runtime",
        "gate_doctrine_deck_visual",
        "gate_doctrine_deck_runtime",
        "gate_breakthrough_reveal_visual",
        "gate_breakthrough_reveal_runtime",
        "gate_pass_runway_visual",
        "gate_pass_runway_runtime",
        "gate_chapter_victory_visual",
        "gate_chapter_victory_runtime",
        "gate_boss_briefing_visual",
        "gate_boss_briefing_runtime",
        "gate_high_dpi_visual",
        "gate_high_dpi_responsive"
      ],
      "rationale": "UI/UX is the explicit objective."
    },
    {
      "dimension_id": "interaction_camera_physics",
      "label": "Interaction, camera, and physics",
      "applicability": "in_scope",
      "scope": [
        "stage selection, chapter navigation and contextual panel actions"
      ],
      "gate_ids": [
        "gate_ui_runtime",
        "gate_boss_briefing_responsive",
        "gate_high_dpi_responsive"
      ],
      "rationale": "The player must manipulate the real shipping screen without blocked map targets."
    },
    {
      "dimension_id": "gameplay_levels_ai",
      "label": "Gameplay, levels, and AI",
      "applicability": "in_scope",
      "scope": [
        "campaign stage availability and attack/preparation routing"
      ],
      "gate_ids": [
        "gate_ui_runtime",
        "gate_boss_briefing_visual"
      ],
      "rationale": "Map presentation must remain bound to real campaign state."
    },
    {
      "dimension_id": "balance_economy_progression",
      "label": "Balance, economy, and progression",
      "applicability": "not_applicable",
      "scope": [],
      "gate_ids": [],
      "rationale": "No values, costs, rewards or unlock rules are changed."
    },
    {
      "dimension_id": "narrative_content",
      "label": "Narrative and content",
      "applicability": "in_scope",
      "scope": [
        "original-inspired occupied-city counterattack atmosphere without copied art"
      ],
      "gate_ids": [
        "gate_ui_visual"
      ],
      "rationale": "The user explicitly requires a stronger original-world feeling and exploration fantasy."
    },
    {
      "dimension_id": "audio",
      "label": "Audio",
      "applicability": "not_applicable",
      "scope": [],
      "gate_ids": [],
      "rationale": "This wave makes no audio claim."
    },
    {
      "dimension_id": "learning_replay",
      "label": "Learning and replay",
      "applicability": "in_scope",
      "scope": [
        "two-second territorial progression and desire to inspect the next landmark"
      ],
      "gate_ids": [
        "gate_player_learning",
        "gate_faction_choice_visual",
        "gate_blueprint_forge_visual",
        "gate_action_compass_visual",
        "gate_achievement_cabinet_visual",
        "gate_growth_duel_visual",
        "gate_doctrine_deck_visual",
        "gate_breakthrough_reveal_visual",
        "gate_pass_runway_visual",
        "gate_chapter_victory_visual"
      ],
      "rationale": "Only target-player observation can close the exploration and comprehension claim."
    },
    {
      "dimension_id": "accessibility_localization",
      "label": "Accessibility and localization",
      "applicability": "in_scope",
      "scope": [
        "dual-coded stage state, Chinese text fit and mobile touch size"
      ],
      "gate_ids": [
        "gate_ui_responsive",
        "gate_factory_responsive",
        "gate_legion_responsive",
        "gate_codex_responsive",
        "gate_faction_choice_responsive",
        "gate_blueprint_forge_responsive",
        "gate_action_compass_responsive",
        "gate_achievement_cabinet_responsive",
        "gate_growth_duel_responsive",
        "gate_doctrine_deck_responsive",
        "gate_breakthrough_reveal_responsive",
        "gate_pass_runway_responsive",
        "gate_chapter_victory_responsive"
      ],
      "rationale": "The target viewports and non-colour state encoding are explicit constraints."
    },
    {
      "dimension_id": "correctness_data_lifecycle",
      "label": "Correctness, data, and lifecycle",
      "applicability": "in_scope",
      "scope": [
        "screen rebuild, selection signals, disabled states and repeat navigation"
      ],
      "gate_ids": [
        "gate_ui_runtime",
        "gate_ui_responsive",
        "gate_factory_runtime",
        "gate_legion_runtime",
        "gate_codex_runtime",
        "gate_codex_responsive",
        "gate_faction_choice_runtime",
        "gate_faction_choice_responsive",
        "gate_blueprint_forge_runtime",
        "gate_blueprint_forge_responsive",
        "gate_action_compass_runtime",
        "gate_action_compass_responsive",
        "gate_achievement_cabinet_runtime",
        "gate_achievement_cabinet_responsive",
        "gate_growth_duel_runtime",
        "gate_growth_duel_responsive",
        "gate_doctrine_deck_runtime",
        "gate_doctrine_deck_responsive",
        "gate_breakthrough_reveal_runtime",
        "gate_breakthrough_reveal_responsive",
        "gate_pass_runway_runtime",
        "gate_pass_runway_responsive",
        "gate_chapter_victory_runtime",
        "gate_chapter_victory_responsive",
        "gate_boss_briefing_runtime",
        "gate_boss_briefing_responsive",
        "gate_high_dpi_runtime"
      ],
      "rationale": "Visual changes must not break the shipping campaign flow."
    },
    {
      "dimension_id": "performance_stability",
      "label": "Performance and stability",
      "applicability": "in_scope",
      "scope": [
        "Web-safe map drawing and lightweight raster budget"
      ],
      "gate_ids": [
        "gate_ui_runtime",
        "gate_high_dpi_runtime"
      ],